{
  "schemaVersion": "0.1",
  "id": "lung-map",
  "modelAssetId": "lung-model",
  "levels": [
    { "id": "system", "label": "Respiratory system" },
    { "id": "lobe", "label": "Lobe" },
    { "id": "segment", "label": "Segment" },
    { "id": "structure", "label": "Structure" }
  ],
  "structures": [
    {
      "id": "respiratory-system",
      "levelId": "system",
      "label": "Respiratory system",
      "meshNames": [
        "right_upper_lobe",
        "right_middle_lobe",
        "right_lower_lobe",
        "left_upper_lobe",
        "left_lower_lobe",
        "trachea",
        "right_main_bronchus",
        "left_main_bronchus"
      ]
    },
    {
      "id": "trachea",
      "levelId": "structure",
      "parentId": "respiratory-system",
      "label": "Trachea",
      "meshNames": ["trachea"]
    },
    {
      "id": "right-main-bronchus",
      "levelId": "structure",
      "parentId": "respiratory-system",
      "label": "Right main bronchus",
      "meshNames": ["right_main_bronchus"]
    },
    {
      "id": "left-main-bronchus",
      "levelId": "structure",
      "parentId": "respiratory-system",
      "label": "Left main bronchus",
      "meshNames": ["left_main_bronchus"]
    },
    {
      "id": "right-upper-lobe",
      "levelId": "lobe",
      "parentId": "respiratory-system",
      "label": "Right upper lobe",
      "meshNames": ["right_upper_lobe"]
    },
    {
      "id": "right-middle-lobe",
      "levelId": "lobe",
      "parentId": "respiratory-system",
      "label": "Right middle lobe",
      "meshNames": ["right_middle_lobe"]
    },
    {
      "id": "right-lower-lobe",
      "levelId": "lobe",
      "parentId": "respiratory-system",
      "label": "Right lower lobe",
      "meshNames": ["right_lower_lobe"]
    },
    {
      "id": "left-upper-lobe",
      "levelId": "lobe",
      "parentId": "respiratory-system",
      "label": "Left upper lobe",
      "meshNames": ["left_upper_lobe"]
    },
    {
      "id": "left-lower-lobe",
      "levelId": "lobe",
      "parentId": "respiratory-system",
      "label": "Left lower lobe",
      "meshNames": ["left_lower_lobe"]
    }
  ],
  "waypoints": [
    {
      "id": "trachea-mid",
      "label": "Trachea",
      "position": [0, -48, 1280],
      "lookAt": [0, -72, 1265],
      "next": ["carina"],
      "radius": 8,
      "lumen": { "ringCount": 8 }
    },
    {
      "id": "carina",
      "label": "Carina",
      "position": [0, -72, 1265],
      "lookAt": [-22, -90, 1248],
      "next": ["right-main-airway", "left-main-airway"],
      "radius": 7,
      "lumen": { "ringCount": 7 }
    },
    {
      "id": "right-main-airway",
      "label": "Right main airway",
      "position": [-22, -90, 1248],
      "lookAt": [-45, -108, 1235],
      "next": ["right-upper-airway", "right-lower-airway"],
      "radius": 5,
      "lumen": { "ringCount": 5 }
    },
    {
      "id": "left-main-airway",
      "label": "Left main airway",
      "position": [22, -90, 1248],
      "lookAt": [45, -108, 1235],
      "next": ["left-upper-airway", "left-lower-airway"],
      "radius": 5,
      "lumen": { "ringCount": 5 }
    },
    {
      "id": "right-upper-airway",
      "label": "Right upper lobar airway",
      "position": [-48, -103, 1280],
      "lookAt": [-66, -112, 1302],
      "next": [],
      "radius": 3.5
    },
    {
      "id": "right-lower-airway",
      "label": "Right lower lobar airway",
      "position": [-44, -118, 1222],
      "lookAt": [-62, -140, 1195],
      "next": [
        "right-lower-superior-segment",
        "right-lower-lateral-basal-segment",
        "right-lower-posterior-basal-segment"
      ],
      "radius": 3.5
    },
    {
      "id": "right-lower-superior-segment",
      "label": "Superior segmental airway",
      "position": [-66, -136, 1228],
      "lookAt": [-82, -151, 1238],
      "next": [],
      "radius": 2.5
    },
    {
      "id": "right-lower-lateral-basal-segment",
      "label": "Lateral basal segmental airway",
      "position": [-67, -145, 1194],
      "lookAt": [-84, -163, 1183],
      "next": [],
      "radius": 2.4
    },
    {
      "id": "right-lower-posterior-basal-segment",
      "label": "Posterior basal segmental airway",
      "position": [-61, -151, 1182],
      "lookAt": [-77, -171, 1161],
      "next": ["right-lower-posterior-basal-distal"],
      "radius": 2.4,
      "lumen": { "ringCount": 4 }
    },
    {
      "id": "right-lower-posterior-basal-distal",
      "label": "Distal posterior basal airway",
      "position": [-78, -173, 1159],
      "lookAt": [-91, -188, 1143],
      "next": [],
      "radius": 1.7,
      "lumen": { "ringCount": 3 }
    },
    {
      "id": "left-upper-airway",
      "label": "Left upper lobar airway",
      "position": [48, -103, 1280],
      "lookAt": [66, -112, 1302],
      "next": [],
      "radius": 3.5
    },
    {
      "id": "left-lower-airway",
      "label": "Left lower lobar airway",
      "position": [44, -118, 1222],
      "lookAt": [62, -140, 1195],
      "next": [],
      "radius": 3.5
    }
  ]
}
